{
  "$schema": "http://json-schema.org/schema#",
  "type": "object",
  "properties": {
    "id": {
      "type": "integer"
    },
    "name": {
      "type": "string"
    },
    "decreased_stat": {
      "anyOf": [
        {
          "type": "null"
        },
        {
          "$ref": "/schema/v2/named_api_resource.json"
        }
      ]
    },
    "increased_stat": {
      "anyOf": [
        {
          "type": "null"
        },
        {
          "$ref": "/schema/v2/named_api_resource.json"
        }
      ]
    },
    "likes_flavor": {
      "anyOf": [
        {
          "type": "null"
        },
        {
          "$ref": "/schema/v2/named_api_resource.json"
        }
      ]
    },
    "hates_flavor": {
      "anyOf": [
        {
          "type": "null"
        },
        {
          "$ref": "/schema/v2/named_api_resource.json"
        }
      ]
    },
    "pokeathlon_stat_changes": {
      "type": "array",
      "items": {
        "type": "object",
        "properties": {
          "max_change": {
            "type": "integer"
          },
          "pokeathlon_stat": {
            "$ref": "/schema/v2/named_api_resource.json"
          }
        },
        "required": [
          "max_change",
          "pokeathlon_stat"
        ]
      }
    },
    "move_battle_style_preferences": {
      "type": "array",
      "items": {
        "type": "object",
        "properties": {
          "low_hp_preference": {
            "type": "integer"
          },
          "high_hp_preference": {
            "type": "integer"
          },
          "move_battle_style": {
            "$ref": "/schema/v2/named_api_resource.json"
          }
        },
        "required": [
          "high_hp_preference",
          "low_hp_preference",
          "move_battle_style"
        ]
      }
    },
    "names": {
      "type": "array",
      "items": {
        "$ref": "/schema/v2/name.json"
      }
    }
  },
  "required": [
    "decreased_stat",
    "hates_flavor",
    "id",
    "increased_stat",
    "likes_flavor",
    "move_battle_style_preferences",
    "name",
    "names",
    "pokeathlon_stat_changes"
  ]
}